{
  "$schema": "https://ripota.org/schemas/v2/manifest.schema.json",
  "schemaVersion": 2,
  "algorithmVersion": 1,
  "unionEngine": {
    "name": "jsts",
    "version": "2.12.1"
  },
  "validationEngine": {
    "name": "jsts",
    "version": "2.12.1"
  },
  "records": [
    {
      "reference": "US-0513",
      "sourceArtifact": "./source-features/us-0513.geojson",
      "displayArtifact": "./boundaries/us-0513.geojson",
      "sourceSha256": "3947761be7ea49795101b75c1b9d9119b1b300f0f1eb2ae5dc260d0da56ff09b",
      "displaySha256": "a656ba6102b6c36e3e2852fc93c1991934237ba044df5a1aa674c6f4475810bc",
      "sourceFeatureCount": 1,
      "displayFeatureCount": 1,
      "componentCount": 5,
      "holeCount": 0,
      "coordinateCount": 403,
      "unionInputAreaSquareMeters": 522658.32776458643,
      "displayAreaSquareMeters": 521956.31165188045,
      "operations": [
        {
          "operation": "unary-union"
        }
      ]
    },
    {
      "reference": "US-0514",
      "sourceArtifact": "./source-features/us-0514.geojson",
      "displayArtifact": "./boundaries/us-0514.geojson",
      "sourceSha256": "5bd3ed6fc1a70cec0448fb65985e2bb2c1ff845b4975e793bfa72468a4392c45",
      "displaySha256": "ff98f82274533015fcff850c3d54b44036959aac5df50ff46a3f58e7a138a01f",
      "sourceFeatureCount": 1,
      "displayFeatureCount": 1,
      "componentCount": 29,
      "holeCount": 0,
      "coordinateCount": 5231,
      "unionInputAreaSquareMeters": 2284757.061295903,
      "displayAreaSquareMeters": 2284757.061295504,
      "operations": [
        {
          "operation": "unary-union"
        }
      ]
    },
    {
      "reference": "US-0515",
      "sourceArtifact": "./source-features/us-0515.geojson",
      "displayArtifact": "./boundaries/us-0515.geojson",
      "sourceSha256": "75b559d31e8f46fde572b85eb978910f6e23d4156c1f320fffcf3bb23d618282",
      "displaySha256": "bfe4c1994788cb1ab96907078b6513ec105d79a6ed3a28613b7005245200f604",
      "sourceFeatureCount": 1,
      "displayFeatureCount": 1,
      "componentCount": 10,
      "holeCount": 0,
      "coordinateCount": 1661,
      "unionInputAreaSquareMeters": 3567297.718061283,
      "displayAreaSquareMeters": 3567297.718063889,
      "operations": [
        {
          "operation": "unary-union"
        }
      ]
    },
    {
      "reference": "US-0516",
      "sourceArtifact": "./source-features/us-0516.geojson",
      "displayArtifact": "./boundaries/us-0516.geojson",
      "sourceSha256": "6ccc3ec63931b03786ea6493a73c6502820dc9f7e47d1b6ed7ef41039e634dc8",
      "displaySha256": "ffa2801619ad5ac7dd6aa032573e680cfac20a63031a0b1f2f2c79c9a66c2f6f",
      "sourceFeatureCount": 1,
      "displayFeatureCount": 1,
      "componentCount": 1,
      "holeCount": 0,
      "coordinateCount": 241,
      "unionInputAreaSquareMeters": 984548.6737081499,
      "displayAreaSquareMeters": 984548.6737077717,
      "operations": [
        {
          "operation": "unary-union"
        }
      ]
    },
    {
      "reference": "US-0517",
      "sourceArtifact": "./source-features/us-0517.geojson",
      "displayArtifact": "./boundaries/us-0517.geojson",
      "sourceSha256": "71622f944f810cef308d59214f5168b083238c88c1ef5144433d0363ae4bb5b3",
      "displaySha256": "6d3750e0bd1610a0978d4a66cef5c8a11607954dc56caeb4be15d3365b05dbdf",
      "sourceFeatureCount": 1,
      "displayFeatureCount": 1,
      "componentCount": 4,
      "holeCount": 0,
      "coordinateCount": 401,
      "unionInputAreaSquareMeters": 3387226.8893764927,
      "displayAreaSquareMeters": 3312828.942315185,
      "operations": [
        {
          "operation": "unary-union"
        }
      ]
    },
    {
      "reference": "US-0789",
      "sourceArtifact": "./source-features/us-0789.geojson",
      "displayArtifact": "./boundaries/us-0789.geojson",
      "sourceSha256": "98e45931b3aa6da857308623299b1b02de64c6c880e3f3a4db10699b2a137d14",
      "displaySha256": "5bfa64acc525f92aa6de0408c17052eb4e808fd5c2def469b64f885b837f8194",
      "sourceFeatureCount": 1,
      "displayFeatureCount": 1,
      "componentCount": 1,
      "holeCount": 0,
      "coordinateCount": 190,
      "unionInputAreaSquareMeters": 18348.923791019075,
      "displayAreaSquareMeters": 18348.923790944402,
      "operations": [
        {
          "operation": "unary-union"
        }
      ]
    },
    {
      "reference": "US-10541",
      "sourceArtifact": "./source-features/us-10541.geojson",
      "displayArtifact": "./boundaries/us-10541.geojson",
      "sourceSha256": "70aa5bc6dd00ba3abc98aa938b08e3c77f24e6ba4cb09cd42d14f2f3e213277b",
      "displaySha256": "51213e81864bcee38cecf6745ae0f942abe7ecdb374e36cb5164b0339e2e4e70",
      "sourceFeatureCount": 1,
      "displayFeatureCount": 1,
      "componentCount": 1,
      "holeCount": 0,
      "coordinateCount": 67,
      "unionInputAreaSquareMeters": 11585.612521935182,
      "displayAreaSquareMeters": 11585.612521935182,
      "operations": [
        {
          "operation": "unary-union"
        }
      ]
    },
    {
      "reference": "US-10542",
      "sourceArtifact": "./source-features/us-10542.geojson",
      "displayArtifact": "./boundaries/us-10542.geojson",
      "sourceSha256": "69a2c05acc8fbdfe4b9d13e4fa8772b8397d8001fc2031ce69d8a07fac2eb1e4",
      "displaySha256": "001f7bf2c32ee5205af5b4668e44ea6211005705da19241789bdb9b8f73a786f",
      "sourceFeatureCount": 2,
      "displayFeatureCount": 1,
      "componentCount": 1,
      "holeCount": 0,
      "coordinateCount": 69,
      "unionInputAreaSquareMeters": 116774.24176160773,
      "displayAreaSquareMeters": 116774.24176161633,
      "operations": [
        {
          "operation": "unary-union"
        }
      ]
    },
    {
      "reference": "US-10543",
      "sourceArtifact": "./source-features/us-10543.geojson",
      "displayArtifact": "./boundaries/us-10543.geojson",
      "sourceSha256": "36cb6acbc9ada3189c073f0aeb5c0607f1d9d17b1dff03273cfbc11a53707967",
      "displaySha256": "aa8e963ff11673261f37a7bf941045744a12f3f4422122cca937fcfedf297ed0",
      "sourceFeatureCount": 1,
      "displayFeatureCount": 1,
      "componentCount": 1,
      "holeCount": 0,
      "coordinateCount": 22,
      "unionInputAreaSquareMeters": 4700.86574518024,
      "displayAreaSquareMeters": 4700.86574518024,
      "operations": [
        {
          "operation": "unary-union"
        }
      ]
    },
    {
      "reference": "US-10544",
      "sourceArtifact": "./source-features/us-10544.geojson",
      "displayArtifact": "./boundaries/us-10544.geojson",
      "sourceSha256": "4670f9c5c9d4e8845d28ef492395a59981785978150f06a7d8ce9760934cc528",
      "displaySha256": "0569d5d6657260e0a344e8c73127067595ffb203d5b6b4d17adf71af95f79d1a",
      "sourceFeatureCount": 3,
      "displayFeatureCount": 1,
      "componentCount": 1,
      "holeCount": 0,
      "coordinateCount": 12,
      "unionInputAreaSquareMeters": 40873.434074119206,
      "displayAreaSquareMeters": 40873.43407404615,
      "operations": [
        {
          "operation": "unary-union"
        }
      ]
    },
    {
      "reference": "US-10545",
      "sourceArtifact": "./source-features/us-10545.geojson",
      "displayArtifact": "./boundaries/us-10545.geojson",
      "sourceSha256": "fece5bf2dc31fba0d6234fc8c611fe1a8c6c64d8e1d7de8b228d1ebb49d9ff81",
      "displaySha256": "faaa71dce31d0e80a60c5d260bb7a99a556d3c6e2c5e917cffc76dce4224d319",
      "sourceFeatureCount": 1,
      "displayFeatureCount": 1,
      "componentCount": 2,
      "holeCount": 0,
      "coordinateCount": 59,
      "unionInputAreaSquareMeters": 448746.2468716074,
      "displayAreaSquareMeters": 448746.246871573,
      "operations": [
        {
          "operation": "unary-union"
        }
      ]
    },
    {
      "reference": "US-10546",
      "sourceArtifact": "./source-features/us-10546.geojson",
      "displayArtifact": "./boundaries/us-10546.geojson",
      "sourceSha256": "0e80c269e48ebe3a032e749e4d6bf77e7861e8d17535613f882c1680e93aa188",
      "displaySha256": "b60597e34bf1f37e2dd889d3690c44279051f8b9d68ca90c0612ed5f58338e37",
      "sourceFeatureCount": 3,
      "displayFeatureCount": 1,
      "componentCount": 2,
      "holeCount": 0,
      "coordinateCount": 78,
      "unionInputAreaSquareMeters": 1802295.6811391877,
      "displayAreaSquareMeters": 1802241.0765659995,
      "operations": [
        {
          "operation": "unary-union"
        }
      ]
    },
    {
      "reference": "US-10547",
      "sourceArtifact": "./source-features/us-10547.geojson",
      "displayArtifact": "./boundaries/us-10547.geojson",
      "sourceSha256": "03c1ed790042eaac2e8e089a712b49735d4d916e93d7132cfe99b7bbc8f868a4",
      "displaySha256": "46e277d9b2a493549761ab222b5165629adbc5ea08af850ce5dd6fd5a5fd1b2b",
      "sourceFeatureCount": 2,
      "displayFeatureCount": 1,
      "componentCount": 3,
      "holeCount": 0,
      "coordinateCount": 238,
      "unionInputAreaSquareMeters": 575533.6340132278,
      "displayAreaSquareMeters": 575533.6340132278,
      "operations": [
        {
          "operation": "unary-union"
        }
      ]
    },
    {
      "reference": "US-10548",
      "sourceArtifact": "./source-features/us-10548.geojson",
      "displayArtifact": "./boundaries/us-10548.geojson",
      "sourceSha256": "6ec44e6209709292f6bb5f2a08559aecd8f577a7e90a20b1f0f45fc4fdad5c4e",
      "displaySha256": "1f8c6f0a72efb58fa4ed6fe19c7713699089dad0e50de6063b80bfa3dc68ec93",
      "sourceFeatureCount": 1,
      "displayFeatureCount": 1,
      "componentCount": 1,
      "holeCount": 0,
      "coordinateCount": 18,
      "unionInputAreaSquareMeters": 4938.031408773744,
      "displayAreaSquareMeters": 4938.031408773744,
      "operations": [
        {
          "operation": "unary-union"
        }
      ]
    },
    {
      "reference": "US-2868",
      "sourceArtifact": "./source-features/us-2868.geojson",
      "displayArtifact": "./boundaries/us-2868.geojson",